{
  "schema_version": 1,
  "phase": "P1",
  "currentTask": "T-0169",
  "nextTask": null,
  "lock": {
    "owner": "AKIHA:7a4a9c48-1",
    "acquiredAt": "2026-10-14T03:33:00Z",
    "ttlMinutes": 180
  },
  "humanQuestions": [
    {
      "id": "HQ-0001",
      "taskId": "T-0003",
      "reason": "permission-denied",
      "question": "The session's auto-mode permission classifier denied spawning the executor sub-agent for T-0003 with reason [Self-Approval] (the executor would implement, have its own reviewer sub-agent approve, and squash-merge the PR without a human). CLAUDE.md A-13 and the scheduled routine require this autonomous merge. Should the owner (a) allow it for the driver session (permission rule / permission mode for the scheduled task), or (b) change the procedure so the driver stops at an approved Draft PR and the owner merges?",
      "askedAt": "2026-10-05T18:22:00Z",
      "issueComment": "https://github.com/myungjoo/HIL-Claw/issues/5#issuecomment-6000504089",
      "resolvedAt": "2026-10-06T04:16:15Z",
      "decision": "(a) — owner reply https://github.com/myungjoo/HIL-Claw/issues/5#issuecomment-6009218647: the routine runs with Bypass permissions, the dedicated driver clone as working folder and a pinned model (D13, main 6dcdce4). A-13 unchanged. Resume T-0003."
    },
    {
      "id": "HQ-0002",
      "taskId": "T-0003",
      "reason": "requirement-unclear",
      "question": "PR #16 (T-0003, CI skeleton) is red on its first run: `pip install --group dev` resolves `ruff>=0.15.14` to ruff 0.16.10, which reports SIM905 at hilclaw/driver_state.py:26 (already on main since T-0004; ruff 0.15.14 used locally does not). Every fix lies outside T-0003's single allowed file (.github/workflows/ci.yml). How should it go green? (a) fix hilclaw/driver_state.py:26 (list literal instead of str.split) in T-0003 or a small preceding code task, keeping the unpinned `ruff>=` bound; (b) bound or pin the dev tools in pyproject.toml so local and CI versions agree (the pin/lock policy deferred at T-0002 review N1); (c) both.",
      "askedAt": "2026-10-06T04:21:00Z",
      "issueComment": "https://github.com/myungjoo/HIL-Claw/issues/5#issuecomment-6009266810",
      "resolvedAt": "2026-10-06T07:39:42Z",
      "decision": "(c) — owner reply https://github.com/myungjoo/HIL-Claw/issues/5#issuecomment-6011684226: fix hilclaw/driver_state.py:26 and pin the dev tools exactly (ruff==0.16.10, pytest==9.1.1) in pyproject.toml as a small code task (T-0009) that lands before T-0003 resumes; T-0003 keeps to the workflow file; local tools upgraded to the same versions; pin bumps are deliberate tasks from now on. T-0003 set to TODO with dependsOn T-0009; nextTask = T-0009 (owner edit, no lock)."
    },
    {
      "id": "HQ-0003",
      "taskId": "T-0014",
      "reason": "new-external-dependency",
      "question": "PLAN P0.5-3 (coverage gate, D12: `hilclaw/` line >= 80% and function >= 80%) needs three choices D12 leaves open. (1) Tool: (a) add `coverage` (exact pin) to the `dev` dependency group, a new external dependency (A-13); or (b) a stdlib-only tracer (`sys.settrace` around pytest), a 100-150 line gate script that test rule 5 leaves untested? (2) Is \"function coverage\" = `def`s entered at least once / all `def`s in `hilclaw/` (methods and nested functions counted; lambdas, comprehensions and class bodies not)? (3) Are the thresholds on the package total, and may a CI check script live outside `hilclaw/` (a new top-level directory), or must it stay inline in the workflow as in T-0011?",
      "askedAt": "2026-10-06T11:23:05Z",
      "issueComment": "https://github.com/myungjoo/HIL-Claw/issues/5#issuecomment-6015206161",
      "resolvedAt": "2026-10-08T04:39:31Z",
      "decision": "(1)(a), (2) yes as written, (3) package total and inline — owner reply https://github.com/myungjoo/HIL-Claw/issues/5#issuecomment-6052108898: add `coverage==7.16.2` to the `dev` dependency group of pyproject.toml as an exact pin (its JSON report carries per-function data since 7.6.0); a function is every `def` / `async def` under `hilclaw/`, methods and nested functions included, lambdas, comprehensions, generator expressions and class bodies not; a function counts as entered when at least one of its lines executed; coverage.py's unnamed module-level region (name \"\" in the JSON report) is excluded from numerator and denominator; both thresholds apply to the package total of `hilclaw/`, not per module; the lines computing the function percentage from the JSON report stay inline in the workflow step as in T-0011, no new top-level directory and nothing under `hilclaw/`. Resume T-0014. T-0014 set to TODO, nextTask = T-0014."
    },
    {
      "id": "HQ-0004",
      "taskId": "T-0036",
      "reason": "owner-only-decision",
      "question": "PLAN P1-3 (verification half of the harness) needs the two owner items it is marked with, for the first case only: `cpu_standin`, kind `gemm`, fp32, C kernel. (1) Reference oracle (open part of #5 A-7): (a) NumPy float64 as recommended there — `numpy` becomes the first runtime dependency of `hilclaw` (a new external dependency, A-13), exact pin; (b) a float64 reference written in C inside the harness and built with clang like the timing driver, no new dependency; (c) something else (name it)? (2) Tolerance vocabulary of the instance parameter for this case (#5 B-7): (a) per-element `rtol` and `atol`, pass iff |out - ref| <= atol + rtol * |ref| for every element, any non-finite output fails; (b) another form (name it)? (3) Defaults: (a) none — an instance must state its tolerance; (b) default values (name them)? Not asked here: vendor golden outputs, downstream-metric thresholds, datasets (B-8), other kinds, dtypes and backends.",
      "askedAt": "2026-10-07T02:44:20Z",
      "issueComment": "https://github.com/myungjoo/HIL-Claw/issues/5#issuecomment-6029803639",
      "resolvedAt": "2026-10-08T04:39:35Z",
      "decision": "(1)(a), (2)(a), (3)(a) — owner reply https://github.com/myungjoo/HIL-Claw/issues/5#issuecomment-6052377983: the reference is NumPy float64 (the float64 product of the drawn fp32 inputs widened to float64), computed on the Python side of the harness; the process that runs the kernel holds neither the reference nor the comparison; `numpy` becomes the first runtime dependency of `hilclaw`, approved by this answer, pinned exactly by the code task that adds it (newest release with wheels for CPython 3.11 and 3.14); how inputs and the kernel's output reach the Python side is the record's design and is not decided; this closes the \"Still open\" line of A-7 for `cpu_standin` only, not B-7 in general. Tolerance: per-element `rtol` and `atol`, both instance parameters (FR-9); pass iff |out - ref| <= atol + rtol*|ref| for every element; any NaN or infinity in the output fails; premise: the verification inputs of this case are drawn finite. Defaults: none, an instance must state both; StandardScenarios S0 step 2 is reworded in the coverage re-check of T-0036. Note: read ADR-0010 to ADR-0016 as well, ADR-0016 in particular, and re-read the scope sentence \"not an FR-10 tool contract\" against it; the answer does not decide the harness/backend split. Resume T-0036. T-0036 set to TODO and started in the same iteration."
    },
    {
      "id": "HQ-0005",
      "taskId": "T-0088",
      "reason": "requirement-unclear",
      "question": "The rest of PLAN P1-1 (the contracts of `sim.run` / `board.run` and the second record of `correctness.check`) needs the owner's reading of #5 A-7 against FR-1, FR-9 and FR-10 (OD-18 sub-question 7), for the first backend `cpu_standin` only. A-7 names one \"run\" in its loop; FR-1 has a sim step and a board step, and FR-9 has the correctness check \"at both points\"; `cpu_standin` has one kind of experiment, the compiled kernel run on the CPU. (1) Under which HW tool is that experiment offered: (a) `board.run` only - the backend does not offer `sim.run`; (b) `sim.run` only - it does not offer `board.run`; (c) both, each carrying out the same local run; (d) something else (name it)? (2) If (1) leaves a point the target does not offer (a call there answers the reserved kind `not_offered`, ADR-0016), what does the round loop of FR-1 do: (a) it skips that step and the rules FR-1 gives the remaining point apply unchanged (board only: a failed check drops the candidate, there is no repair return and no promotion filter; sim only: a failed check returns to code generation, and the sim measurement is what the round evaluates and records); (b) it skips that step and the one point takes both roles (a failed check returns to code generation up to the repair bound and then drops the candidate; its measurement is the final one); (c) another rule (name it)? (3) Correctness on `cpu_standin`: (a) one check per attempt, at the one offered point; (b) two checks per attempt, one as the sim-point check and one as the board-point check, also where both are the same local run? If two: does FR-9's \"동일 검증을 반복한다\" mean (i) the same procedure with inputs drawn anew for each check (the reading ADR-0021 decision 3 took), or (ii) the same drawn inputs at both points? (4) The mock backend (FR-10: contract tests): may a run whose hw_profile names the mock be answered by the first case's `correctness.check` contract - the oracle of the HQ-0004 answer, and the `tolerance` member of `instance.json` read with the meaning it has for `cpu_standin` - so that the contract tests of P1-1 run the judging over the mock: (a) yes; (b) no, the mock gets its own rule (name it)? Not asked here: anything about a real simulator or board (#5 B-2, B-3), the promotion rule and k (OD-15, OD-29), the objective (#5 A-4), `profiler.collect`, `blob.push` / `blob.fetch`, budgets and spend (OD-2, OD-19), recovery after a failure (OD-10), and the oracle or tolerance of any other backend beyond (4).",
      "askedAt": "2026-10-09T02:48:50Z",